ChapterNumber,CharCountDiff,LevDistance,Link,Title
CTM98020,0.0,2.0,View changes,CTM98020 Corporation Tax Self-Assessment Time Limit
CTM98205,0.0,2.0,View changes,CTM98205 CTSA: General
CTM98215,0.0,2.0,View changes,CTM98215 CTSA: Claims To Relief - General
CTM98220,0.0,2.0,View changes,CTM98220 CTSA: Claims To Relief - Action To Take
CTM98240,0.0,3.0,View changes,CTM98240 CTSA: Late Payment Interest
CTM98250,1.0,5.0,View changes,CTM98250 CTSA: CTPF - Assessment
DANSP42000,0.0,2.0,View changes,DANSP42000 Notices Of Decisions: Difficulties Serving The Notice
DANSP42100,0.0,2.0,View changes,DANSP42100 Of Decision: Introduction
DANSP42200,0.0,2.0,View changes,DANSP42200 Of Decision: Notice Of Decision Returned Undelivered
DANSP42400,0.0,2.0,View changes,DANSP42400 Of Decision: Person Mislays The Decision
DMBM670940,0.0,2.0,View changes,DMBM670940 Which Debts Can And Cannot Be Arrested
DMBM675000,0.0,2.0,View changes,DMBM675000 Summary Proceedings (Scotland): Contents
DMBM676410,0.0,3.0,View changes,DMBM676410 Summary Proceedings (Sc): Arrestments/Earnings Arrestments/Attachments/Exceptional Attachments: Contents
DMBM676500,0.0,2.0,View changes,DMBM676500 Earnings Arrestment Already In Place
DMBM676530,0.0,3.0,View changes,DMBM676530 Recovering Costs For Cases Where Arrestments Have Been Laid
DMBM676550,0.0,3.0,View changes,DMBM676550 Preliminary Action Required In All Cases Where Attachment/Exceptional Attachment Being Pursued Under A Summary Cause (SP) Decree
DMBM677510,0.0,2.0,View changes,DMBM677510 Summary Proceedings (Sc): Small Claims - Registering The Summons In Court And Effecting Service: Contents
DMBM677910,0.0,2.0,View changes,DMBM677910 Summary Proceedings (Sc): Small Claims - Obtaining And Enforcing Decree: Contents
DT16350PP,0.0,1.0,View changes,DT16350PP St Christopher (St Kitts) And Nevis: Contents
DT16403,0.0,1.0,View changes,"DT16403 DT: Double Taxation Agreement, Article 4: Associated Enterprises"
DT16405,0.0,2.0,View changes,"DT16405 DT: Double Taxation Agreement, Article 6: Dividends"
DT2850PP,18.0,48.0,View changes,DT2850 Double Taxation Relief Manual: Azerbaijan: Contents
DT2851,110.0,183.0,View changes,DT2851 Azerbaijan: Tax Credit Relief
DT2852,1966.0,2465.0,View changes,DT2852 Azerbaijan: Source
DT2853,1144.0,1279.0,View changes,DT2853 Azerbaijan: Dividends
DT2854,713.0,802.0,View changes,DT2854 Azerbaijan: Interest
DT2855,882.0,1038.0,View changes,DT2855 Azerbaijan: Royalties
EIM04700,0.0,2.0,View changes,EIM04700 Particular Items: R To Z: Contents
EIM06600,0.0,2.0,View changes,EIM06600 Exemption For Suggestion Scheme Awards: Introduction
EIM06652,0.0,2.0,View changes,EIM06652 Exemption For Suggestion Scheme Awards: Two Or More Awards For Same Suggestion On Different Occasions: Example
EIM06670,0.0,2.0,View changes,EIM06670 Exemption For Suggestion Scheme Awards: Employer Using Scheme To Make Non-Qualifying Awards
EIM10300,0.0,4.0,View changes,EIM10300 Travelling And Subsistence Payments: Particular Occupations
EIM65799,0.0,2.0,View changes,EIM65799 Tax Treatment Of Particular Occupations: Contents L To R
EIM68600,0.0,2.0,View changes,"EIM68600 Tax Treatment Of Recorders, Circuit Judges And Deputy Circuit Judges: General"
EM6411,0.0,4.0,View changes,EM6411 Contract Settlement: Post Settlement Issues - Reopening A Settlement: Contents
EM6412,0.0,3.0,View changes,EM6412 Introduction
EM6417,0.0,3.0,View changes,EM6417 Procedures When Repayment Due
ETASSUM34000,736.0,2860.0,View changes,ETASSUM34000 Schedule 3 SAYE Option Schemes: Linkage To Savings (Arrangement): Contents
ETASSUM34140,215.0,717.0,View changes,ETASSUM34140 Temporary Postponement Of Contributions
FRS2300,0.0,2.0,View changes,FRS2300 Common Areas Of Uncertainty Regarding The Scheme
FRS3600,0.0,2.0,View changes,FRS3600 Why Are There So Many Exclusions?
FRS5000,0.0,2.0,View changes,FRS5000 Addressing Risks And Assurance: Contents
FRS5100,0.0,2.0,View changes,FRS5100 What Are The Key Risks Of The Scheme?
FRS7000,0.0,2.0,View changes,FRS7000 Trade Sectors: Contents
HMAG30000,0.0,2.0,View changes,HMAG30000 Registration And Approval: Contents
HMAG31400,0.0,2.0,View changes,HMAG31400 Continuing To Monitor Approved/Authorised Traders
HMAG31500,0.0,2.0,View changes,HMAG31500 Post Approval Visits: Contents
HMAG32000,0.0,2.0,View changes,HMAG32000 Cancelling An Authorisation/Approval
HMRC-MANUALS,362.0,427.0,View changes,HMRC Manuals
HMWARE8010,0.0,2.0,View changes,HMWARE8010 General Information
IEIM111000,0.0,3.0,View changes,IEIM111000 Outward Requests
IEIM111030,0.0,4.0,View changes,IEIM111030 Outward Requests: How To Make A Request
IHTM02000,0.0,4.0,View changes,IHTM02000 Communications: Contents
IHTM02031,0.0,3.0,View changes,IHTM02031 Confidentiality And Disclosure Of Information: The General Rule On Disclosure And Its Operation: Disclosure - The General Rule And Its Operation
IHTM02033,0.0,3.0,View changes,IHTM02033 Confidentiality And Disclosure Of Information: The General Rule On Disclosure And Its Operation: Disclosing Information To Public Bodies
IHTM11222,11.0,17.0,View changes,IHTM11222 Gifts For National Purposes: Procedure
IHTM11224,14.0,26.0,View changes,IHTM11224 Gifts For National Purposes: Qualifying Bodies
IHTM11260,31.0,539.0,View changes,IHTM11260 Exemptions: Conditional Exemption
IHTM42650,17.0,140.0,View changes,IHTM42650 Other Taxes And Investigation: Heritage
INTM152000,0.0,2.0,View changes,INTM152000 Double Taxation Agreements: Introduction: Contents
INTM152030,0.0,2.0,View changes,INTM152030 Revision Of Agreements
INTM152050,0.0,1.0,View changes,INTM152050 UK Agreements
INTM152060,0.0,1.0,View changes,INTM152060 Domestic Law
INTM154020,0.0,2.0,View changes,INTM154020 Double Dual Residents
INTM162070,2273.0,2299.0,View changes,INTM162070 What HMRC Will Check - Whether There Are Any Obvious Reasons Why The Customer Might Not Be Entitled To Treaty Benefits
INTM162080,830.0,2302.0,View changes,INTM162080 Meaning Of Beneficial Ownership
INTM162090,111.0,198.0,View changes,INTM162090 Meaning Of Subject To Tax
INTM210000,0.0,4.0,View changes,INTM210000 The CFC Charge Gateway Chapter 7 - Captive Insurance Business: Contents
INTM210200,0.0,3.0,View changes,INTM210200 Interaction With Other Chapters
INTM210400,0.0,2.0,View changes,INTM210400 Contracts Of Insurance Falling Within TIOPA10/S371GA(2)
INTM219500,0.0,3.0,View changes,INTM219500 Transfer Pricing Adjustments In The Context Of Chapter 9
INTM248100,1336.0,1350.0,View changes,INTM248100 Alphabetic Index Of Terms Defined In Part 9A
INTM248350,141.0,349.0,View changes,Definitions For Terms In Part 9A: Alphabetic Index Of Terms Defined In Part 9A: Connected Persons
INTM267620,0.0,3.0,View changes,INTM267620 Foreign Banks Trading In The UK Through A Permanent Establishment: Contents
INTM267622,0.0,3.0,View changes,INTM267622 Foreign Banks Trading In The UK Through Permanent Establishments: Attribution Of Profits To A Permanent Establishment
INTM267650,0.0,2.0,View changes,INTM267650 Representative Offices
INTM285000,0.0,3.0,View changes,INTM285000 Foreign Permanent Establishments Of UK Companies - Capital Allowances: Contents
INTM285020,0.0,3.0,View changes,INTM285020 Foreign Permanent Establishments Of UK Companies: Capital Allowances: Plant & Machinery: Notional Cas
INTM285040,0.0,3.0,View changes,INTM285040 Foreign Permanent Establishments Of UK Companies: Capital Allowances: Plant & Machinery: Pools Of Expenditure
INTM285060,0.0,3.0,View changes,INTM285060 Foreign Permanent Establishments Of UK Companies: Capital Allowances: Plant & Machinery: Mineral Extraction Allowances And Other Allowances
INTM286000,0.0,3.0,View changes,INTM286000 Anti-Diversion Rule For Relevant Periods Beginning Before 1 January 2013 And The Anti-Diversion Rule For Relevant Accounting Periods Beginning On Or After 1 January 2013: Contents
INTM286060,0.0,3.0,View changes,INTM286060 Anti-Diversion Rule: Proportionate Reduction Where Motive Test Not Met
INTM286080,0.0,2.0,View changes,INTM286080 Anti-Diversion Rule: Safe Harbour Provisions
INTM286100,0.0,2.0,View changes,INTM286100 Anti-Diversion Rule: “Period Of Grace” Clearances
INTM286300,0.0,3.0,View changes,INTM286300 Anti-Diversion Rule: Introduction For Relevant Accounting Periods Beginning On Or After 1 January 2013.
INTM286440,0.0,2.0,View changes,INTM286440 Anti-Diversion Rule: Diverted Profits Gateway Approach: Example 2.
INTM286460,0.0,2.0,View changes,INTM286460 Anti-Diversion Rule: Entity Exemption Approach
INTM287000,0.0,2.0,View changes,INTM287000 Foreign Permanent Establishments Of UK Companies - Exclusions And Definitions: Contents
INTM287030,0.0,2.0,View changes,INTM287030 Foreign Permanent Establishments Of UK Companies: Exclusions And Definitions: Restriction On Exemption
INTM287050,0.0,2.0,View changes,INTM287050 Foreign Permanent Establishments Of UK Companies: Exclusions And Definitions: Banks And Interest On Advances From Banks
INTM330100,0.0,2.0,View changes,INTM330100 Double Taxation Applications And Claims: DT Forms: Contents
INTM330110,0.0,2.0,View changes,INTM330110 Introduction
INTM338000,0.0,3.0,View changes,INTM338000 Double Taxation Applications And Claims: Applicants/Claimants: Overseas Collecting Societies: Contents
INTM338050,0.0,3.0,View changes,INTM338050 Performing Right Society (PRS)
INTM338080,0.0,3.0,View changes,INTM338080 Authors’ Licensing Collecting Society (ALCS)
INTM338100,0.0,3.0,View changes,INTM338100 Design & Artists Copyright Society (DACS)
INTM338500,0.0,2.0,View changes,INTM338500 Applicants/Claimants - Provisional Treaty Relief Scheme: Contents
INTM338560,0.0,3.0,View changes,INTM338560 DT Applications And Claims Scheme For Interest
INTM338580,0.0,3.0,View changes,INTM338580 DT Applications And Claims Scheme For Interest
IPT01300,1.0,4.0,View changes,IPT01300 Policy Objectives
IPT02000,188.0,422.0,View changes,IPT02000 The Insurance Industry: Contents
IPT02100,1.0,4.0,View changes,IPT02100 Purpose And Outline Of This Section
IPT02200,129.0,133.0,View changes,IPT02200 What Is Insurance?: Contents
IPT02220,7.0,10.0,View changes,IPT02220 What Is Insurance? Spreading The Risk
IPT02240,3.0,6.0,View changes,IPT02240 What Is Insurance? Long Term Practices
IPT02260,0.0,3.0,View changes,IPT02260 What Is Insurance? Reinsurance
IPT02300,176.0,320.0,View changes,IPT02300 Types Of Insurance: Contents
IPT02310,1.0,4.0,View changes,IPT02310 Purpose And Outline Of This Section
IPT02320,0.0,3.0,View changes,IPT02320 Long-Term Insurance
IPT02400,2.0,5.0,View changes,IPT02400 Lloyd's
IPT02500,3.0,7.0,View changes,IPT02500 Brokers And Other Intermediaries
IPT02600,1.0,4.0,View changes,IPT02600 Insurance Regulation
IPT02700,1.0,4.0,View changes,IPT02700 Further Resources
IPT03100,4.0,7.0,View changes,IPT03100 Purpose And Outline Of This Section
IPT03200,4.0,7.0,View changes,IPT03200 UK Law
IPT03250,3.0,7.0,View changes,IPT03250 Where To Find The Relevant Law
IPT03300,0.0,2.0,View changes,IPT03300 Scope Of IPT
IPT03350,0.0,2.0,View changes,IPT03350 Value Of A Premium For IPT Purposes
IPT03520,0.0,2.0,View changes,IPT03520 Determining Whether There Is An Insurer For IPT Purposes
IPT03540,0.0,2.0,View changes,IPT03540 Fronting
IPT03700,730.0,1283.0,View changes,IPT03700 How To Determine Whether There Is A Contract Of Insurance: Contents
IPT03720,3.0,7.0,View changes,IPT03720 Definitions Of A Contract Of Insurance
IPT03760,1.0,3.0,View changes,IPT03760 Extended Warranties
IPT03770,0.0,2.0,View changes,IPT03770 Financial Guarantees
IPT04000,547.0,654.0,View changes,IPT04000 Liability Of Insurance Contracts: Contents
IPT04100,1.0,3.0,View changes,IPT04100 Purpose And Outline Of This Section
IPT04200,188.0,324.0,View changes,IPT04200 Reinsurance: Contents
IPT04220,6.0,8.0,View changes,IPT04220 Reinsurance: Contracts Of Reinsurance
IPT04230,4.0,6.0,View changes,IPT04230 Reinsurance: What Is Not Regarded As A Contract Of Reinsurance?
IPT04240,4.0,6.0,View changes,IPT04240 Reinsurance: Reinsurance Of Surety Bonds Or Similar Products
IPT04250,313.0,540.0,View changes,IPT04250 Long-Term Business: Contents
IPT04255,4.0,6.0,View changes,IPT04255 Long-Term Business: Legal Provisions
IPT04265,8.0,10.0,View changes,IPT04265 Long-Term Business: Definition Of
IPT04270,2.0,4.0,View changes,IPT04270 Long-Term Business: Long-Term Contracts Including An Element Of General Insurance
IPT04275,7.0,9.0,View changes,IPT04275 Long-Term Business: Definition Of Permanent Health Insurance (PHI)
IPT04280,15.0,17.0,View changes,IPT04280 Long-Term Business: Medical Insurance
IPT04300,224.0,384.0,View changes,IPT04300 Risks Outside The UK: Contents
IPT04320,6.0,8.0,View changes,IPT04320 Establishing The Location Of A Risk
IPT04330,1.0,3.0,View changes,IPT04330 Habitually Resident
IPT04340,8.0,10.0,View changes,IPT04340 Establishment
IPT04350,8.0,10.0,View changes,IPT04350 Commercial Ships
IPT04400,3.0,5.0,View changes,IPT04400 Lifeboats
IPT04450,1.0,3.0,View changes,IPT04450 Commercial Aircraft
IPT04550,11.0,13.0,View changes,IPT04550 The Channel Tunnel
IPT04600,340.0,532.0,View changes,IPT04600 Goods In Foreign Or International Transit: Contents
IPT04620,3.0,5.0,View changes,IPT04620 Definition Of
IPT04630,7.0,9.0,View changes,IPT04630 Definition Of
IPT04640,15.0,17.0,View changes,IPT04640 What The Exemption Covers
IPT04700,305.0,889.0,View changes,IPT04700 Export Finance: Contents
IPT04710,1.0,3.0,View changes,IPT04710 Legal Provisions
IPT04720,5.0,7.0,View changes,IPT04720 Definition Of A
IPT04730,26.0,34.0,View changes,IPT04730 Definition Of
IPT04740,3.0,5.0,View changes,IPT04740 Export Credit Insurance Contracts
IPT04750,4.0,6.0,View changes,IPT04750 Risks Relating To Exchange Rate Losses
IPT04760,14.0,17.0,View changes,IPT04760 Contracts Relating To The Provision Of Financial Facilities
IPT04770,2.0,5.0,View changes,IPT04770 Purpose Of These Exemptions
IPT04800,486.0,1033.0,View changes,IPT04800 Motability Contract-Hire Schemes: Contents
IPT04810,4.0,7.0,View changes,IPT04810 Motability Contract-Hire Schemes: Legal Provisions
IPT04820,1.0,4.0,View changes,IPT04820 Motability Contract-Hire Schemes: Purpose Of This Exemption
IPT04830,4.0,8.0,View changes,"IPT04830 Motability Contract-Hire Schemes: Definition Of ""Qualifying Terms"""
IPT04840,2.0,5.0,View changes,"IPT04840 Motability Contract-Hire Schemes: Definition Of 'Handicapped', 'Disability Living Allowance', 'Personal Independence Payment', 'Armed Forces Independence Payment' And 'Mobility Supplement'"
IPT04860,7.0,10.0,View changes,IPT04860 Motability Contract-Hire Schemes: Insurers Who Underwrite A Similar Scheme
IPT04900,596.0,1405.0,View changes,IPT04900 Higher Rate Of IPT: Contents
IPT04905,3.0,6.0,View changes,IPT04905 Legal Provisions And Purpose
IPT04910,6.0,68.0,View changes,IPT04910 Definition Of “Motor Car” And “Motor Cycle”
IPT04915,7.0,10.0,View changes,IPT04915 Definition Of Domestic Appliances
IPT04916,7.0,10.0,View changes,IPT04916 Definition Of Certain Circumstances
IPT04920,4.0,8.0,View changes,IPT04920 Suppliers Of Motor Vehicles Or Specified Goods?
IPT04925,8.0,11.0,View changes,IPT04925 Statement Of Practice
IPT04930,9.0,12.0,View changes,IPT04930 Protected Cell Companies
IPT04935,5.0,8.0,View changes,IPT04935 Treatment Of Different Types Of Insurance
IPT04940,288.0,500.0,View changes,IPT04940 Travel Insurance: Contents
IPT04945,7.0,10.0,View changes,IPT04945 Purpose And Outline Of The Section
IPT04950,18.0,21.0,View changes,IPT04950 De Minimis Provisions For Travel
IPT04955,2.0,5.0,View changes,IPT04955 Corporate Travel Policies
IPT05000,845.0,2329.0,View changes,IPT05000 Calculating The Value Of The Premium: Contents
IPT05150,10.0,12.0,View changes,IPT05150 Definition Of Premium
IPT05160,370.0,961.0,View changes,IPT05160 Separate Contracts: Contents
IPT05165,1.0,4.0,View changes,IPT05165 Legal Background
IPT05175,2.0,6.0,View changes,IPT05175 Avoidance And ‘Commoditised’ Insurance Products
IPT05190,0.0,4.0,View changes,IPT05190 Accounting For The IPT On Amounts Charged Under Separate Contracts
IPT05250,2.0,5.0,View changes,IPT05250 How The Value Of ‘Any Risk’ Is Determined
IPT05450,1.0,4.0,View changes,IPT05450 Premiums Are Inclusive Of Tax
IPT05500,4.0,6.0,View changes,IPT05500 Discounted Premiums
IPT05560,0.0,2.0,View changes,IPT05560 Intermediaries: The Effect Of Intermediaries On The Value Of The Premium
IPT05570,0.0,2.0,View changes,IPT05570 Intermediaries: Commissions
IPT05580,3.0,5.0,View changes,IPT05580 Intermediaries: Credit Charges Which Are Not Part Of The Premium
IPT05590,0.0,2.0,View changes,IPT05590 Intermediaries: Intermediary Discounted Premiums
IPT05600,0.0,2.0,View changes,IPT05600 Premiums Received Other Than In Money
IPT05650,6.0,8.0,View changes,IPT05650 Contracts At Less Than Open Market Value (OMV)
IPT05750,3.0,5.0,View changes,IPT05750 Employers' Liability Insurance
IPT05800,816.0,1180.0,View changes,IPT05800 Types Of Contract Covering Exempt And Taxable Risks: Contents
IPT05820,8.0,10.0,View changes,IPT05820 Arriving At ‘The Chargeable Amount’
IPT05840,620.0,824.0,View changes,IPT05840 Methods Of Apportionment
IPT05850,1.0,3.0,View changes,IPT05850 What ‘Establishment’ Means
IPT05880,2.0,4.0,View changes,IPT05880 Local Decisions On Apportionment
IPT05900,539.0,1286.0,View changes,IPT05900 The De Minimis Provision: Contents
IPT05910,2.0,7.0,View changes,IPT05910 Purpose And Outline Of This Section
IPT05920,4.0,6.0,View changes,IPT05920 General Effect Of The Provision
IPT05930,4.0,6.0,View changes,IPT05930 Effect Of The De Minimis Limits On Co-Insurance
IPT05940,8.0,10.0,View changes,IPT05940 Effect Of The De Minimis Limits On ‘Layered’ Insurance
IPT05950,8.0,10.0,View changes,IPT05950 Effect Of The De Minimis Limits On Group Life Policies
IPT05960,2.0,4.0,View changes,IPT05960 When And How To Apply De Minimis Provision
IPT05970,2.0,4.0,View changes,IPT05970 The Effect Of Additional / Return Premiums On De Minimis
IPT05980,4.0,6.0,View changes,IPT05980 Problem Areas
IPT06000,326.0,359.0,View changes,IPT06000 Maintaining The IPT Register: Contents
IPT06100,1.0,3.0,View changes,IPT06100 Purpose And Outline Of This Section
IPT06210,1.0,3.0,View changes,IPT06210 Registration: Registration Thresholds For IPT
IPT06215,4.0,6.0,View changes,IPT06215 Registration: When Notification Should Be Made
IPT06225,1.0,3.0,View changes,IPT06225 Registration: Registration Of Lloyd's Syndicates
IPT06230,1.0,3.0,View changes,IPT06230 Registration: Registration Of Overseas Insurers
IPT06235,9.0,11.0,View changes,IPT06235 Registration: Registration Of Groups
IPT06245,0.0,2.0,View changes,IPT06245 Registration: The Meaning Of ‘Effective Date Of Registration’
IPT06250,4.0,6.0,View changes,IPT06250 Registration: Rules For Waiver Of Requirement To Submit IPT Returns
IPT06260,1.0,3.0,View changes,IPT06260 Registration: Penalties For Failure To Register
IPT06305,1.0,3.0,View changes,IPT06305 Purpose And Outline
IPT06330,0.0,2.0,View changes,IPT06330 Changing An Agent
IPT06345,1.0,3.0,View changes,IPT06345 Returns And Payment Of Tax
IPT06350,3.0,5.0,View changes,IPT06350 Unregistered Overseas Insurers
IPT06355,2.0,4.0,View changes,IPT06355 Intermediaries Collecting IPT For Unregistered Insurers
IPT06400,325.0,676.0,View changes,IPT06400 Transfer Of Going Concerns (TOGC): Contents
IPT06410,4.0,7.0,View changes,IPT06410 Purpose And Outline Of This Section
IPT06420,4.0,7.0,View changes,IPT06420 Features Of A TOGC
IPT06430,1.0,4.0,View changes,IPT06430 Requests To Take Over An Existing IPT Registration
IPT06440,4.0,8.0,View changes,IPT06440 Responsibilities Under A TOGC
IPT06510,2.0,6.0,View changes,IPT06510 Deregistration: Purpose And Outline Of This Section
IPT06610,1.0,4.0,View changes,IPT06610 Purpose And Outline Of This Section
IPT06620,2.0,5.0,View changes,IPT06620 Correcting Or Amending The Register
IPT06630,2.0,6.0,View changes,IPT06630 Duplicate Entries In The Register
IPT06660,3.0,6.0,View changes,IPT06660 Incorrect Date Of Registration
IPT06670,1.0,4.0,View changes,IPT06670 Procedures For Changes To Bank Account Details
IPT06680,1.0,4.0,View changes,IPT06680 Failure To Notify Changes
IPT06700,4.0,7.0,View changes,"IPT06700 Insolvency, Death Or Incapacity"
IPT06810,2.0,5.0,View changes,IPT06810 Purpose And Outline Of This Section
IPT06820,1.0,4.0,View changes,IPT06820 Legal Basis For The Registration Of Certain Taxable Intermediaries
IPT06830,14.0,18.0,View changes,IPT06830 Criteria For Registration
IPT06850,4.0,7.0,View changes,IPT06850 Apportionment And De Minimis
IPT06870,2.0,5.0,View changes,IPT06870 Other Information
IPT07100,0.0,3.0,View changes,IPT07100 Purpose And Outline Of This Section
IPT07210,3.0,6.0,View changes,IPT07210 Purpose And Outline Of This Section
IPT07220,5.0,8.0,View changes,IPT07220 Accounting Periods
IPT07240,1.0,4.0,View changes,IPT07240 Tax Points
IPT07250,2.0,5.0,View changes,IPT07250 Accounting Arrangements For Lloyd's Syndicates
IPT07300,7.0,15.0,View changes,IPT07300 Bad Debt Relief
IPT07400,0.0,3.0,View changes,IPT07400 Errors On IPT Returns
IPT07500,0.0,3.0,View changes,IPT07500 IPT Accounting Schemes
IPT07600,1335.0,1383.0,View changes,IPT07600 The Special Accounting Scheme: Contents
IPT07605,3.0,5.0,View changes,IPT07605 Purpose And Outline Of This Section
IPT07610,9.0,11.0,View changes,IPT07610 Withdrawals Or Expulsions From The Scheme
IPT07615,2.0,4.0,View changes,IPT07615 Definition Of
IPT07620,9.0,11.0,View changes,IPT07620 Tax Points Under The Special Accounting Scheme
IPT07625,13.0,15.0,View changes,IPT07625 Complications Relating To Tax Points Under The Special Accounting Scheme
IPT07635,5.0,7.0,View changes,IPT07635 Insurance Premium Tax: Payments In Advance
IPT07640,4.0,6.0,View changes,IPT07640 Insurance Premium Tax: Payments In Instalments
IPT07645,15.0,17.0,View changes,IPT07645 Insurance Premium Tax: Delays In Bringing Tax To Account
IPT07650,3.0,5.0,View changes,IPT07650 Insurance Premium Tax: How The Guidelines Are Applied
IPT07655,3.0,5.0,View changes,IPT07655 Insurance Premium Tax: Accounting For Tax On Leaving The Scheme
IPT07670,16.0,18.0,View changes,IPT07670 Insurance Premium Tax: Effect Of Additional Premiums (Aps) On De Minimis Contracts
IPT07675,8.0,10.0,View changes,IPT07675 Insurance Premium Tax: Effect Of Return Premiums (Rps) On De Minimis Contracts
IPT07680,1.0,3.0,View changes,IPT07680 Insurance Premium Tax: Tax Credits
IPT07700,1079.0,1216.0,View changes,IPT07700 The Cash Receipt Accounting Method: Contents
IPT07710,1.0,3.0,View changes,IPT07710 Definition Of ‘Cash Receipt’
IPT07715,0.0,2.0,View changes,IPT07715 Definition Of Receipt ‘By An Insurer’
IPT07745,8.0,10.0,View changes,IPT07745 Accounting For Tax On Ceasing To Use The Cash Receipt Method
IPT07765,6.0,8.0,View changes,IPT07765 Effect Of Aps And Rps On De Minimis Contracts
IPT07770,2.0,4.0,View changes,IPT07770 Tax Receipts Under The Cash Receipt Method
IPT07800,849.0,1062.0,View changes,IPT07800 Transitional Accounting Arrangements: Contents
IPT07805,24.0,1086.0,View changes,IPT07805 Purpose And Outline Of This Section
IPT07810,702.0,763.0,View changes,IPT07810 Cash Receipt Method
IPT07815,151.0,3035.0,View changes,IPT07815 Special Accounting Scheme
IPT07820,805.0,8189.0,View changes,IPT07820 Additional Premiums
IPT07825,37.0,1858.0,View changes,IPT07825 Monthly Written Contracts
IPT07830,34.0,1149.0,View changes,IPT07830 Premiums Paid On A Monthly Or Other Regular Basis
IPT07835,28.0,362.0,View changes,IPT07835 The Effect Of A Rate Change On De Minimis Policies
IPT07840,621.0,3656.0,View changes,IPT07840 The Anti-Forestalling Provisions
IPT07845,494.0,1158.0,View changes,IPT07845 Contracts Providing Cover For A Period Exceeding 12 Months
IPT07850,34.0,170.0,View changes,IPT07850 Penalties On Errors Relating To The Rate Changes
IPT07855,219.0,227.0,View changes,IPT07855 Rates Of Tax
IPT07860,245.0,282.0,View changes,IPT07860 Relevant Dates For Transitional And Anti-Forestalling Provisions
IPT07900,124.0,158.0,View changes,IPT07900 Unjust Enrichment: Contents
IPT07905,5.0,7.0,View changes,IPT07905 Purpose And Outline Of This Section
IPT07910,996.0,1054.0,View changes,IPT07910 The Reimbursement Scheme: Contents
IPT07915,4.0,6.0,View changes,IPT07915 Purpose And Outline Of This Section
IPT07920,1.0,3.0,View changes,IPT07920 Where The Scheme Does Not Apply
IPT07925,1.0,3.0,View changes,IPT07925 Partial Reimbursements
IPT07930,2.0,4.0,View changes,IPT07930 Administering The Scheme
IPT07935,2.0,4.0,View changes,IPT07935 Deregistered Claimants
IPT07940,1.0,3.0,View changes,IPT07940 Statutory Interest
IPT07945,2.0,4.0,View changes,IPT07945 The Statutory Provisions
IPT07950,4.0,6.0,View changes,IPT07950 The Regulations
IPT07955,2.0,4.0,View changes,IPT07955 Time Limits
IPT07960,1.0,3.0,View changes,IPT07960 Records To Be Kept
IPT07965,3.0,6.0,View changes,IPT07965 The Undertaking
IPT07970,1.0,4.0,View changes,IPT07970 Assessment Provisions
IPT08050,0.0,23.0,View changes,IPT08050 Purpose And Outline Of IPT08000
IPT08100,0.0,4.0,View changes,IPT08100 Roles And Responsibilities
IPT08150,2.0,5.0,View changes,IPT08150 The Purpose Of IPT Assurance
IPT08200,117.0,122.0,View changes,IPT08200 Legal Provisions: Contents
IPT08210,9.0,16.0,View changes,IPT08210 The Law
IPT08220,2.0,5.0,View changes,IPT08220 Legal Requirements
IPT08260,2.0,5.0,View changes,IPT08260 Principal Place Of Business And Place To Visit
IPT08265,8.0,11.0,View changes,IPT08265 Overseas Visits
IPT08270,1.0,5.0,View changes,IPT08270 Who To See
IPT08275,6.0,10.0,View changes,IPT08275 Non-Visit Assurance
IPT08280,11.0,14.0,View changes,IPT08280 Pre-Visit Preparation
IPT08290,1.0,4.0,View changes,IPT08290 Visit Notes And Reports
IPT08300,12.0,15.0,View changes,IPT08300 First Visits
IPT08350,0.0,3.0,View changes,IPT08350 Mutual Assistance Directive
IPT08400,24.0,27.0,View changes,IPT08400 Accounts System Overview
IPT08450,391.0,417.0,View changes,IPT08450 IPT Calculations: Contents
IPT08455,4.0,8.0,View changes,IPT08455 Purpose And Outline Of This Section
IPT08460,2.0,5.0,View changes,IPT08460 Liability
